RP14,,"My RP14 seems warm after it's been on for a while, is this normal?","Yes, remember there is a 12AX7 tube in there which dissipates heat; it will get warm.<br><br>"RP14,,"When I assign the expression pedal to a parameter, nothing happens, why?","The expression pedal will only be active if it is assigned to a parameter that exists in the selected effect. For example, the chorus effect does not have a feedback parameter, so you will not hear any change if the expression pedal is linked to ""feedback""."RP14,,"When I use the jam-along jack, I only hear signal out of one side, why?","The jam-along jack is a stereo jack, so make sure that you are using a stereo tip-ring-sleeve (TRS) plug from your CD player.<br><br>"RP14,,How do I balance the volume levels between presets?,"In ""edit""mode, parameter over to the ""Spkr Sim"" column, then parameter down to the volume ""level"" parameter. Use the value up/down buttons to select the desired volume level, then push ""store"" twice to save it."RP20,, What is the hard reset for the RP20?," Power up holding the #1 access button(not the #1 footswitch), then let go of #1 and press/release the Program button."RP21,,Is there an easy way to keep the same volume when changing between programs?,"Yes. The volume pedal update feature automatically assigns volume control in all programs to the volume pedal. This allows you to maintain the same volume when changing between patches. To turn this feature on, press the UTILITY button. Use the PAGE buttons until you arrive at the ""Vol Pedal Update"" page. Turn the dial to turn it on. You do not need to store any changes since this is a utility setting."RP21,,What is the hard reset for the RP21?," Power up holding the #1 access button(not the #1 footswitch), then let go of #1 and press/release the Program button."RP3,,How does the RP3 compare to the RP6 and RP7?,"The RP3 is actually very similar to the RP7 except for the Tube Distortion and being physically smaller (which means there are fewer footswitches). From the sonic standpoint, you shouldn't be able to hear any differences between the RP6 and RP3."RP3,,Can I trade programmed patches with my friends that have an RP6?,"Yes, they have the same programming architectures. Simply jot down the settings and transfer them to/from the RP3/RP6. You can even exchange settings with an RP7 except for the Tube Distortion parameters."RP3,,What types of effects does the RP3 have?,"The effect types of the RP3 include:  Compressor, Wah, 2 distortion types, EQ, Gate/Swell, Mod/Pitch (Chorus, Flange, Phaser, Tremolo, Panning, Pitch Shifting, Whammy, and Harmony), Delay, Reverb, and Cabinet Emulator."RP5,,I can't get the optional expression pedal to work. I'm using the recommended DOD FX17. Maybe I'm connecting it wrong. What's wrong?,"Start by connecting the output of the FX17 to the pedal input on the RP5. Do not connect anything to the input on the FX17. Be sure to use the optional AC power supply for the FX17. It will not send sufficient voltage when used with a battery alone. Finally, edit your presets and assign the CC Pedal type to one of the CC numbers (1-8) printed on the RP5's grid."RP5,,I don't understand the program matrix.  Can you explain it?,"The RP series can be confusing at first.  The first thing to grasp is the concept of what we call the program matrix.  To isolate a particular effect parameter or setting, you need to line up the top row and side column to display the current value.  For example, to isolate Chorus, start on the program you want to modify.  Press the Edit button.  Now press the parameter arrows to the right until the LED on the top row is lit on the MOD/PITCH section.  Now use the same arrows to cursor down once.  The light on the left should be on the second one down.  If you follow this visually to the right you will notice that the cross section of these lights gives you MOD/PITCH and underneath is type.  The display should have the corresponding value for the type.  Now use the Value arrows to modify the type of MOD/PITCH until the display reads Chor (for Chorus).  Now you can use the Parameter arrows again to cursor down once to access the level parameter.  Pressing the Parameter down again will give you the amount and so on."RP6,,I don't understand the program matrix.  Can you explain it?,"The RP series can be confusing at first.  The first thing to grasp is the concept of what we call the program matrix.  To isolate a particular effect parameter or setting, you need to line up the top row and side column to display the current value.  For example, to isolate Chorus, start on the program you want to modify.  Press the Edit button.  Now press the parameter arrows to the right until the LED on the top row is lit on the MOD/PITCH section.  Now use the same arrows to cursor down once.  The light on the left should be on the second one down.  If you follow this visually to the right you will notice that the cross section of these lights gives you MOD/PITCH and underneath is type.  The display should have the corresponding value for the type.  Now use the Value arrows to modify the type of MOD/PITCH until the display reads Chor (for Chorus).  Now you can use the Parameter arrows again to cursor down once to access the level parameter.  Pressing the Parameter down again will give you the amount and so on."RP7,,I can't edit the Speaker Cabinet emulator in any of my programs. It says '9LBL' on the display. Is my unit defective?,"When using the headphone output on the RP7, the speaker cabinet emulator is automatically activated. The '9LBL' stands for GLOBAL. If you unplug your headphones, you'll be able to edit this parameter."RP7,,I don't understand the program matrix.  Can you explain it?,"The RP series can be confusing at first.  The first thing to grasp is the concept of what we call the program matrix.  To isolate a particular effect parameter or setting, you need to line up the top row and side column to display the current value.  For example, to isolate Chorus, start on the program you want to modify.  Press the Edit button.  Now press the parameter arrows to the right until the LED on the top row is lit on the MOD/PITCH section.  Now use the same arrows to cursor down once.  The light on the left should be on the second one down.  If you follow this visually to the right you will notice that the cross section of these lights gives you MOD/PITCH and underneath is type.  The display should have the corresponding value for the type.  Now use the Value arrows to modify the type of MOD/PITCH until the display reads Chor (for Chorus).  Now you can use the Parameter arrows again to cursor down once to access the level parameter.  Pressing the Parameter down again will give you the amount and so on."StudioQuad/V2,,Can I upgrade a Studio Quad or Quad V2 to the Quad4 version?,The Quad4 features hardware improvements (new converters and larger delay RAM) which make the Quad4 software incompatible with the original Quad models.StudioQuad/V2,,"How do I use one program for input one, and another program for input two?","The Studio Quad series products cannot use more than one program at a time. In order to have separate effects on each of the different input/outputs, you must create one program that has a multiple effect configuration, and assign the effects for the inputs/outputs that you want."StudioQuad/V2,,How can I get several effects on each of the 4 inputs/outputs?,"The Studio Quad (and V2) can only run 4 effects at any given time. If you are using all four inputs to run discreet effects, you will only be able to have one effect on each input. If you are running 2 inputs, you can have 2 effects on each input, or three on one, and one on the other. The maximum number of effects in any program IS limited to 4."StudioQuad/V2,,How do I create a program with all four input/outputs running different effects?,"You must first start with a program that has the configuration that you need for the effects capability, and routing. If you are wanting each input to have a different effect, then you want to start with a program using configuration #1. If you are using the Quad V2, you will find all possible configurations between factory programs 101 through 112. If you are using the regular Quad, you will have to scroll through the presets until you find a program using the configuration you need.<br><br>Once you have selected a program with the desired configuration, follow these steps to load the desired effect in to your program.<br><br>1. Press the ""FX edit"" button once. You will notice that the first ""box"" in the block diagram (lower right hand corner of the LCD) will start to flash. This is to indicate that you are about to edit that effect module.<br><br>2. Press the # 2 button to gain access to the type of effect that you want to load.<br><br>3. Roll the data wheel until you find the type of effect that you require for the first effect module.<br><br>4. You can now use the ""next"" and ""previous"" page buttons to find all of the parameters relating to the effect module you have selected. The 1-4 buttons will move the cursor back and forth from the parameters in the LCD.<br><br>5. Once you have the effect set up the way you want it, you can then press the ""FX edit"" button again which will start the second box of the block diagram flashing. This is indicating that you are about to edit the second module. Follow steps 2 though 4 to edit the second effect.<br><br>Each time you press the FX edit button, it will take you to the next effect in the block diagram, and you can follow steps 2 through 4 to set up the third and fourth effect.<br><br>Once you have all four effects set up the way you want them, press the store button 3 times to save these changes."StudioQuad/V2,,How do I reset the Studio Quad to factory settings?,"To reset the Studio Quad (or V2), turn the power off, press and hold the #1 button while turning the power back on. After about 2 seconds, release the #1 button, and press the ""program"" button once. This will reset the entire unit."StudioQuad/V2,,Someone told me there is an upgrade for my Studio Quad.  What new features are included in the V2 upgrade/model?,"Quad V2 Upgrade<br><br>Includes:<br>The V2 upgrade gives you 10 new effect modules (types of effects) Rotary Speaker Simulator, Smooth Pitch Shifter, Harmony, Analog Delay, Stereo Analog Delay, Chorus/Delay, Flange/Delay, Pre Delay, Room Echo, and Compressor.  There is also New and Improved I/O routing and 80 New Programs."StudioQuad4,,Can I upgrade a Studio Quad or Quad V2 to the Quad4 version?,The Quad4 features hardware improvements (new converters and larger delay RAM) which make the Quad4 software incompatible with the original Quad models.StudioQuad4,,How can I get several effects on each of the 4 inputs/outputs?,"The Studio Quad 4 can only run 4 effects at any given time. If you are using all four inputs to run discreet effects, you will only be able to have one effect on each input. If you are running 2 inputs, you can have 2 effects on each input, or three on one, and one on the other. The maximum number of effects in any program IS limited to 4."StudioQuad4,,How do I create a program with all four input/outputs running different effects?,"You must first start with a program that has the configuration that you need for the effects capability, and routing. If you are wanting each input to have a different effect, then you want to start with a program using configuration #1. If you are using the Quad V2, you will find all possible configurations between factory programs 101 through 112. If you are using the regular Quad, you will have to scroll through the presets until you find a program using the configuration you need.<br><br>Once you have selected a program with the desired configuration, follow these steps to load the desired effect in to your program.<br><br>1. Press the ""FX edit"" button once. You will notice that the first ""box"" in the block diagram (lower right hand corner of the LCD) will start to flash. This is to indicate that you are about to edit that effect module.<br><br>2. Press the # 2 button to gain access to the type of effect that you want to load.<br><br>3. Roll the data wheel until you find the type of effect that you require for the first effect module.<br><br>4. You can now use the ""next"" and ""previous"" page buttons to find all of the parameters relating to the effect module you have selected. The 1-4 buttons will move the cursor back and forth from the parameters in the LCD.<br><br>5. Once you have the effect set up the way you want it, you can then press the ""FX edit"" button again which will start the second box of the block diagram flashing. This is indicating that you are about to edit the second module. Follow steps 2 though 4 to edit the second effect.<br><br>Each time you press the FX edit button, it will take you to the next effect in the block diagram, and you can follow steps 2 through 4 to set up the third and fourth effect.<br><br>Once you have all four effects set up the way you want them, press the store button 3 times to save these changes."StudioQuad4,,How do I reset the Studio Quad 4 to factory settings?,"To reset the Studio Quad 4, turn the power off, press and hold the #1 button while turning the power back on. After about 2 seconds, release the #1 button, and press the ""program"" button once. This will reset the entire unit."StudioVocalistEX,,I have the original Studio Vocalist. How can I upgrade it to the EX version?,This upgrade is a paid one.  This is not a user installable version upgrade.  This must be performed by our service department.  The fee is $75.00.  The upgrade is limited to stock on hand.  There are only a few left.  Call for availability:<br><br>Digitech Repair<br>(801) 566-8800<br>Talker,,Can I use a regular (generic) 9V~750mA adapter also without damaging the pedal?<br>What adapter is the correct one for the Talker Pedal?,"The Talker will ONLY work with an adapter that is rated for AC output.  Most adapters use DC voltage output and therefore will NOT work for the Talker.  The PS750 will work.  These are out of stock and are no longer made by Harman.  The new model is PS0913B-120.  This is rated for 9V AC and has 1300mA.  The retail price is $24.95.  You may be able to find one from your local Digitech Dealer.  Or if you prefer:<br><br>This part can be purchased directly from Digitech by calling (801)566-8800.  Or you can send a check or money order to the address below.  Be sure to indicate which part you're requesting in your letter.<br><br>Harman Music Group<br>ATTN: PARTS<br>8760 South Sandy Parkway<br>Sandy, UT 84070<br><br>This part can also be purchased online at our new e-commerce site.  Point your browser to the site below:<br><br>http://outlet.digitech.com<br><br>"TSR24,,What is the hard reset for a TSR 24?,"Power up holding the #1 access button.<br>Release #1 button,<br>Press and release Program Up button.<br>"TSR24S,,What is the hard reset for a TSR24S?,"Power up holding the #1 access button.<br>Release #1 button,<br>Press and release Program Up button.<br>"ValveFX,, What is the hard reset for the Valve FX?,Unit Off.<br>Press and hold Store button.<br>Power ON.<br>Release Store button.<br>Press and release Parameter UP button.XP100,,"The display on my XP100 is showing ""Pd"" and then ""CA"". And it will not work. What can I do to fix it?","The expression pedal on the XP series effect pedals can sometimes lose their calibration settings. This is usually caused by stepping on the expression pedal harder than normal. This will move the expression pedal farther than it was originally calibrated at. When this happens, the pedal needs to be recalibrated. The display will show ""Pb"" which is asking you to place the pedal back (toe up). After placing the pedal back, press the bypass button once. The display will change and show ""Pf"". This is asking you to place the pedal forward (toe down). Again, after rocking the pedal forward, press the bypass button once. Finally the display will show ""SA"" indicating that it has saved the calibration. The XP will return to a normal operating mode after this procedure has been performed."XP100,,How do I reset the XP100?,"To reinitialize the XP100, you disconnect the power, press and hold the ""bypass"" switch while reconnecting the power. After about 2 seconds, release the bypass button, and then press it one more time. The display will then ask you to recalibrate the pedal, so just follow the recalibration procedure listed in the previous question."XP200,,"The display on my XP200 is showing ""Pd"" and then ""CA"". And it will not work. What can I do to fix it?","The expression pedal on the XP series effect pedals can sometimes lose their calibration settings. This is usually caused by stepping on the expression pedal harder than normal. This will move the expression pedal farther than it was originally calibrated at. When this happens, the pedal needs to be recalibrated. The display will show ""Pb"" which is asking you to place the pedal back (toe up). After placing the pedal back, press the bypass button once. The display will change and show ""Pf"". This is asking you to place the pedal forward (toe down). Again, after rocking the pedal forward, press the bypass button once. Finally the display will show ""SA"" indicating that it has saved the calibration. The XP will return to a normal operating mode after this procedure has been performed."XP200,,How do I reset the XP200?,"To reinitialize the XP200, you disconnect the power, press and hold the ""bypass"" switch while reconnecting the power. After about 2 seconds, release the bypass button, and then press it one more time. The display will then ask you to recalibrate the pedal, so just follow the recalibration procedure listed in the previous question."XP300,,"The display on my XP300 is showing ""Pd"" and then ""CA"". And it will not work. What can I do to fix it?","The expression pedal on the XP series effect pedals can sometimes lose their calibration settings. This is usually caused by stepping on the expression pedal harder than normal. This will move the expression pedal farther than it was originally calibrated at. When this happens, the pedal needs to be recalibrated. The display will show ""Pb"" which is asking you to place the pedal back (toe up). After placing the pedal back, press the bypass button once. The display will change and show ""Pf"". This is asking you to place the pedal forward (toe down). Again, after rocking the pedal forward, press the bypass button once. Finally the display will show ""SA"" indicating that it has saved the calibration. The XP will return to a normal operating mode after this procedure has been performed."XP300,,How do I reset the XP300?,"To reinitialize the XP300, you disconnect the power, press and hold the ""bypass"" switch while reconnecting the power. After about 2 seconds, release the bypass button, and then press it one more time. The display will then ask you to recalibrate the pedal, so just follow the recalibration procedure listed in the previous question."Vocal300,,How do I save a program to a new location on the Vocal 300?,"There is a misprint on page 5 of the Vocal 300 owners manual. To store and relocate a program, dial up the desired program, modify as desired, press STORE once to rename the program, press  store again and the program # blinks. Now use the UP/DOWN footswitches to get to the desired program #, then press STORE again. The program will now be stored in the User section at the new location."